{
  "$schema": "../schemas/FILES.schema.json",
  "schema_version": "1.0",
  "generated_at": "2026-05-21T04:53:31.186Z",
  "root_relative_path": "scripts",
  "directory": {
    "name": "scripts",
    "path": "scripts"
  },
  "children": [
    {
      "name": "check-public-sources.mjs",
      "type": "file",
      "path": "scripts/check-public-sources.mjs",
      "ext": ".mjs",
      "size": 1248,
      "mtimeMs": 1779254633730.5378,
      "hash": "sha1:a1d46d3322988610c17f6d3c1d6a1ca27f9ed397",
      "summary": "MJS file",
      "importance": "normal",
      "status": "active"
    }
  ],
  "sync": {
    "child_count": 1,
    "file_count": 1,
    "dir_count": 0,
    "last_full_sync": null,
    "last_incremental_sync": "2026-05-21T04:53:31.186Z"
  }
}
