{
  "$schema": "../schemas/FILES.schema.json",
  "schema_version": "1.0",
  "generated_at": "2026-05-21T04:53:31.188Z",
  "root_relative_path": "test",
  "directory": {
    "name": "test",
    "path": "test"
  },
  "children": [
    {
      "name": "cli.test.mjs",
      "type": "file",
      "path": "test/cli.test.mjs",
      "ext": ".mjs",
      "size": 8712,
      "mtimeMs": 1779339177377.3843,
      "hash": "sha1:a86951d642b0c61805b6a10759697b85a736da98",
      "summary": "MJS file",
      "importance": "normal",
      "status": "active"
    }
  ],
  "sync": {
    "child_count": 1,
    "file_count": 1,
    "dir_count": 0,
    "last_full_sync": null,
    "last_incremental_sync": "2026-05-21T04:53:31.188Z"
  }
}
